{
 "$schema":"http://json-schema.org/draft-04/schema#","type":"object","required":["schema_version","design_id","capabilities","trust_policy"],
 "properties":{"schema_version":{"enum":["1.0"]},"design_id":{"type":"string"},"capabilities":{"type":"array","minItems":6,"items":{"type":"object","required":["id","status","innovation_hypothesis","architecture_contract","validation_gates","failure_conditions","evidence_requirements"],"properties":{"id":{"enum":["jaxpr_lowering","autodiff_backprop","conv_recurrent_custom_ops","cuda_measurement","rank5_plus","paper_to_fact"]},"status":{"enum":["design_only","prototype_candidate","validated"]},"innovation_hypothesis":{"type":"string"},"architecture_contract":{"type":"object","required":["inputs","outputs","state","invariants"],"properties":{"inputs":{"type":"array","items":{"type":"string"}},"outputs":{"type":"array","items":{"type":"string"}},"state":{"type":"array","items":{"type":"string"}},"invariants":{"type":"array","items":{"type":"string"}}},"additionalProperties":false},"validation_gates":{"type":"array","minItems":2,"items":{"type":"object","required":["id","test","pass_condition"],"properties":{"id":{"type":"string"},"test":{"type":"string"},"pass_condition":{"type":"string"},"artifact":{"type":"string"}},"additionalProperties":false}},"failure_conditions":{"type":"array","minItems":1,"items":{"type":"string"}},"evidence_requirements":{"type":"array","minItems":1,"items":{"type":"string"}},"design_notes":{"type":"array","items":{"type":"string"}}},"additionalProperties":false}},"trust_policy":{"type":"object","required":["facts","inferences","proposals","release_rule"],"properties":{"facts":{"type":"string"},"inferences":{"type":"string"},"proposals":{"type":"string"},"release_rule":{"type":"string"}},"additionalProperties":false}},"additionalProperties":false
}
